ticker,etf_name,description,provider,asset_class,geographic_scope,primary_region,developed_or_emerging,style_focus,size_focus,sector_focus,active_vs_index,benchmark_index,expense_ratio,net_assets_usd,bid_ask_spread_30d,number_of_holdings,pe_ratio,pb_ratio,standard_deviation_3y,equity_beta_3y,top_country_1,top_country_1_weight,top_country_2,top_country_2_weight,top_country_3,top_country_3_weight,other_countries,other_countries_weight,top_industry_1,top_industry_1_weight,top_industry_2,top_industry_2_weight,top_industry_3,top_industry_3_weight,other_industries,other_industries_weight
IYE,iShares U.S. Energy ETF,The iShares U.S. Energy ETF seeks to track an index composed of U.S. equities in the energy sector. The fund can be used to express a view and gain diversified access to oil and gas producers and distributors in the U.S.,iShares / BlackRock,Equity,Single Country,US,Developed,Core,Large Cap,Energy,Index,Russell 1000 Energy RIC 22.5/45 Capped Index,0.38,1601798320.87,0.01619302,37.0,21.09932,2.45973,18.755,0.0546,,,,,,,,,Integrated Oil & Gas,38.88,Oil & Gas Exploration & Production,21.32,Oil & Gas Storage & Transportation,15.96,Oil & Gas Refining & Marketing & Transportation; Oil & Gas Equipment & Services; Semiconductors; Semiconductor Equipment,23.65
IYF,iShares U.S. Financials ETF,"The iShares U.S. Financials ETF seeks to track an index composed of U.S. equities in the financials sector. The fund can be used to express a view and gain diversified access to banks, insurers, and credit card companies in the U.S.",iShares / BlackRock,Equity,Single Country,US,Developed,Core,Large Cap,Financials,Index,Russell 1000 Financials 40 Act 15/22.5 Daily Capped Index,0.38,3629749207.25,0.03261047,142.0,16.23047,1.98275,15.6,0.882,,,,,,,,,Financial Services,47.32,Banks,34.01,Insurance,17.99,Commercial & Professional Services; Software & Services,0.4
IYG,iShares U.S. Financial Services ETF,"The iShares U.S. Financial Services ETF seeks to track an index composed of U.S. equities in the financial services sector. The fund can be used to express a view and gain diversified access to investment banks, asset managers, and exchanges in the U.S.",iShares / BlackRock,Equity,Single Country,US,Developed,Core,Broad/Multi-Cap,Financials,Index,Dow Jones U.S. Financial Services Index,0.38,1972265249.2,0.0347162,100.0,18.72152,2.30152,16.4123,0.9521,,,,,,,,,Financial Services,65.1,Banks,34.72,,,,
IYH,iShares U.S. Healthcare ETF,"The iShares U.S. Healthcare ETF seeks to track an index composed of U.S. equities in the healthcare sector. The fund can be used to express a view and gain diversified access to pharmaceuticals, biotechnology, and healthcare equipment companies in the U.S.",iShares / BlackRock,Equity,Single Country,US,Developed,Core,Large Cap,Healthcare,Index,Russell 1000 Health Care RIC 22.5/45 Capped Index,0.38,3150308156.99,0.01595787,101.0,26.75983,4.53837,13.6792,0.5337,,,,,,,,,Pharmaceuticals,37.76,Biotechnology,21.1,Health Care Equipment,15.58,Managed Health Care; Life Sciences Tools & Services; Health Care Services; Health Care Facilities; Health Care Distributors; Health Care Supplies; Health Care Technology,25.29
IYJ,iShares U.S. Industrials ETF,"The iShares U.S. Industrials ETF seeks to track an index composed of U.S. equities in the industrials sector. The fund can be used to express a view and gain diversified access to U.S. companies involved in construction, manufacturing, and transportation.",iShares / BlackRock,Equity,Single Country,US,Developed,Core,Large Cap,Industrials,Index,Russell 1000 Industrials 40 Act 15/22.5 Daily Capped Index,0.38,1797822202.38,0.05753556,197.0,30.02448,5.6687,16.1519,1.0136,,,,,,,,,Capital Goods,58.49,Financial Services,18.35,Transportation,8.71,"Materials; Commercial & Professional Services; Software & Services; Tech Hardware & Equip; Semiconductors & Semiconductor Equipment; Pharma, Biotech & Life Sciences; Consumer Durables; Consumer Services; Autos & Components",14.2
IYK,iShares U.S. Consumer Staples ETF,"The iShares U.S. Consumer Staples ETF seeks to track an index composed of U.S. equities in the consumer staples sector. The fund can be used to express a view and gain diversified access to producers of food, beverages, and household goods companies in the U.S.",iShares / BlackRock,Equity,Single Country,US,Developed,Core,Large Cap,Consumer,Index,Russell 1000 Consumer Staples RIC 22.5/45 Capped Index,0.38,1419237267.75,0.0138303,54.0,25.45259,3.97192,12.9764,0.3818,,,,,,,,,Food Bevg Tobacco,57.1,Household & Personal Prod,21.55,Health Care Equipment & Services,11.13,Consumer Staples Distribution & Retail; Materials,9.93
IYLD,iShares Morningstar Multi-Asset Income ETF,The iShares Morningstar Multi-Asset Income ETF seeks to track an index of diverse income-generating assets across equity and fixed income. The fund seeks to deliver high current income while providing an opportunity for capital appreciation.,iShares / BlackRock,Multi Asset,Global,US,Developed,Dividend,,Broad Market,Index,Morningstar Multi-Asset High Income Index,0.5,127663182.82,0.1814882,10.0,,,6.3232,0.3177,United States,55.04,Japan,9.9,Australia,4.13,United Kingdom; Supranational; Canada; France; Singapore; Switzerland; Netherlands; Hong Kong; Other,29.91,,,,,,,,
IYM,iShares U.S. Basic Materials ETF,"The iShares U.S. Basic Materials ETF seeks to track an index composed of U.S. equities in the basic materials sector. The fund can be used to express a view and gain diversified access to U.S. companies producing raw materials, including metals, chemicals and forestry products",iShares / BlackRock,Equity,Single Country,US,Developed,Core,Large Cap,Thematic,Index,Russell 1000 Basic Materials RIC 22.5/45 Capped Index,0.38,1288564145.96,0.09052906,38.0,27.78147,3.61478,17.9249,0.7848,,,,,,,,,INDUSTRIAL GASES,24.38,Specialty Chemicals,14.91,Gold,14.19,Steel; Copper; Industrial Machinery & Supplies & Components; Trading Companies & Distributors; Aerospace & Defense; Paper & Plastic Packaging Products & Materials; Fertilizers & Agricultural Chemicals; Commodity Chemicals; Aluminum; Diversified Metals & Mining; Diversified Chemicals,46.24
IYR,iShares U.S. Real Estate ETF,The iShares U.S. Real Estate ETF seeks to track an index composed of U.S. equities in the real estate sector. The fund can be used to express a view and gain diversified access to REITs and real estate companies in the U.S.,iShares / BlackRock,Other,Single Country,US,Developed,Core,Broad/Multi-Cap,Real Estate,Index,Dow Jones U.S. Real Estate Capped Index,0.38,4844812240.45,0.00980248,61.0,,2.54031,16.8855,0.9298,,,,,,,,,Health Care REITs,16.22,Retail Reits,13.96,Industrial REITs,12.4,Data Center REITs; Telecom Tower REITs; Multi-Family Residential REITs; Other Specialized REITs; Self Storage REITs; Real Estate Services; Single-Family Residential REITs; Mortgage Reits; Office REITs; TIMBER REITS; Diversified REIT's; Hotel & Resort REITs,57.09
IYT,iShares U.S. Transportation ETF,"The iShares U.S. Transportation ETF seeks to track an index composed of U.S. equities in the transportation sector. The fund can be used to express a view and gain diversified access to airlines, railroads, and trucking companies in the U.S.",iShares / BlackRock,Equity,Single Country,US,Developed,Core,Broad/Multi-Cap,Broad Market,Index,S&P Transportation Select Industry FMC Capped Index,0.38,2469068763.88,0.04770992,44.0,20.15039,4.25716,20.4187,1.3359,,,,,,,,,Rail Transportation,24.54,Cargo Ground Transportation,22.32,Air Freight & Logistics,18.59,Passenger Airlines; Passenger Ground Transportation; Marine Transportation,34.36
IYW,iShares U.S. Technology ETF,"The iShares U.S. Technology ETF seeks to track an index composed of U.S. equities in the technology sector. The fund can be used to express a view and gain diversified access to software, semiconductors, and tech hardware companies in the U.S.",iShares / BlackRock,Equity,Single Country,US,Developed,Core,Large Cap,Technology,Index,Russell 1000 Technology RIC 22.5/45 Capped Index,0.38,24254557518.36,0.03290691,139.0,44.03878,12.43493,22.0152,1.4405,,,,,,,,,Semiconductors & Semiconductor Equipment,44.9,Tech Hardware & Equip,20.29,Software & Services,18.89,Media & Entertainment; Capital Goods; Commercial & Professional Services; Consumer Services; Financial Services; Consumer Staples Distribution & Retail,15.79
IYY,iShares Dow Jones U.S. ETF,The iShares Dow Jones U.S. ETF seeks to track an index composed of U.S. large- and mid-cap stocks. The fund offers broad exposure to the U.S. equity market.,iShares / BlackRock,Equity,Single Country,US,Developed,Core,Large/Mid Cap,Broad Market,Index,Dow Jones U.S. Index,0.2,2954989631.79,0.0494139,962.0,29.28066,5.1854,13.5889,1.0231,,,,,,,,,Information Technology,36.42,Financials,12.06,Communication,9.53,Consumer Discretionary; Industrials; Health Care; Consumer Staples; Energy; Utilities; Materials; Real Estate,41.75
IYZ,iShares U.S. Telecommunications ETF,"The iShares U.S. Telecommunications ETF seeks to track an index composed of U.S. equities in the telecommunications sector. The fund can be used to express a view and gain diversified access to U.S. companies providing phone, internet, and communication services.",iShares / BlackRock,Equity,Single Country,US,Developed,Core,Large Cap,Broad Market,Index,Russell 1000 Telecommunications RIC 22.5/45 Capped Index,0.38,999611766.09,0.02303351,21.0,18.35786,2.62196,14.6298,0.6098,,,,,,,,,Communications Equip.,46.29,Integrated Telecommunication Services,25.98,Alternative Carriers,11.8,Wireless Telecommunication Services; Movies & Entertainment; Cable & Satellite,15.83
JPXN,iShares JPX-Nikkei 400 ETF,The iShares JPX-Nikkei 400 ETF seeks to track an index composed of Japanese equities screened for profitability and shareholder-friendly practices. The fund offers a way express a single country view and gain targeted exposure to Japan.,iShares / BlackRock,Equity,Single Country,Japan,Developed,Core,Broad/Multi-Cap,Broad Market,Index,JPX-Nikkei Index 400,0.48,132636863.86,0.15536796,389.0,17.35871,1.86164,13.6352,0.6643,,,,,,,,,Industrials,25.43,Information Technology,18.04,Financials,14.69,Consumer Discretionary; Communication; Materials; Health Care; Consumer Staples; Real Estate; Utilities; Energy,40.95
JXI,iShares Global Utilities ETF,"The iShares Global Utilities ETF seeks to track an index composed of global equities in the utilities sector. The fund can be used to express a view and gain diversified access to companies that supply electricity, gas, and water.",iShares / BlackRock,Equity,Global,Global,Mixed,Core,Broad/Multi-Cap,Energy,Index,S&P Global 1200 Utilities (Sector) Capped Index (USD) (Net),0.39,326205763.19,0.17514157,66.0,20.29193,2.24315,14.3128,0.3787,United States,60.91,Spain,8.3,United Kingdom,6.88,Italy; Germany; France; Canada; Japan; Brazil; Australia; Other,23.34,Electric Utilities,60.05,Multi-Utilities,27.15,Independent Power Producers & Energy Traders,4.54,Gas Utilities; Water Utilities; Renewable Electricity,7.7
KSA,iShares MSCI Saudi Arabia ETF,The iShares MSCI Saudi Arabia ETF seeks to track an index composed of Saudi Arabian equities. The fund offers a way to express a single-country view and gain targeted exposure to companies in Saudi Arabia.,iShares / BlackRock,Equity,Single Country,Saudi Arabia,Emerging,Core,Broad/Multi-Cap,Broad Market,Index,MSCI Saudi Arabia IMI 25/50 Index (Net),0.75,681052332.5,0.02595717,117.0,15.3204,2.13049,14.3388,0.2404,,,,,,,,,Financials,40.92,Materials,13.06,Energy,12.67,Communication; Utilities; Health Care; Consumer Staples; Consumer Discretionary; Industrials; Real Estate; Information Technology,33.01
KWT,iShares MSCI Kuwait ETF,The iShares MSCI Kuwait ETF seeks to track an index composed of equities with exposure to Kuwait. The fund offers a way to express a single-country view and gain targeted exposure to companies in Kuwait.,iShares / BlackRock,Equity,Single Country,Kuwait,Mixed,Core,Broad/Multi-Cap,Broad Market,Index,MSCI All Kuwait Select Size Liquidity Capped Index (USD) (Net),0.75,70194230.53,0.65677131,36.0,16.16582,1.63321,10.6813,0.4618,,,,,,,,,Financials,66.21,Real Estate,11.84,Industrials,7.77,Communication; Consumer Discretionary; Materials; Consumer Staples; Utilities; Energy,13.8
KXI,iShares Global Consumer Staples ETF,"The iShares Global Consumer Staples ETF seeks to track an index composed of global equities in the consumer staples sector. The fund can be used to express a view and gain diversified access to companies that produce essential products, including food and household items.",iShares / BlackRock,Equity,Global,Global,Mixed,Core,Broad/Multi-Cap,Consumer,Index,S&P Global 1200 Consumer Staples Sector Capped Index (USD) (Net),0.39,1035810421.92,0.13118577,95.0,23.30476,3.92826,12.1443,0.4079,United States,59.44,United Kingdom,11.71,Japan,5.52,Switzerland; France; Canada; Belgium; Netherlands; Australia; Mexico; Other,22.78,Food Bevg Tobacco,48.8,Consumer Staples Distribution & Retail,30.52,Household & Personal Prod,20.12,,
LCTD,iShares World ex U.S. Carbon Transition Readiness Aware Active ETF,The iShares World ex U.S. Carbon Transition Readiness Aware Active ETF seeks long-term capital appreciation by investing in international companies that BlackRock believes are better positioned to benefit from the transition to a low carbon economy. The fund offers a way to target the low carbon transition in a core equity portfolio.,iShares / BlackRock,Equity,Global,Global,Developed,ESG,Broad/Multi-Cap,Broad Market,Active,MSCI World ex USA Index (USD) (Net),0.37,236828034.66,0.29363503,355.0,,,12.941,0.6669,Japan,21.04,Canada,13.27,United Kingdom,10.98,France; Switzerland; Germany; Netherlands; Australia; Spain; Sweden; Italy; Hong Kong; Denmark; Norway; Finland; Other,53.59,Financials,26.44,Industrials,17.33,Information Technology,11.19,Health Care; Materials; Consumer Discretionary; Consumer Staples; Energy; Utilities; Communication; Real Estate,43.91
LCTU,iShares U.S. Carbon Transition Readiness Aware Active ETF,The iShares U.S. Carbon Transition Readiness Aware Active ETF seeks long-term capital appreciation by investing in U.S. large- and mid-cap companies that BlackRock believes are better positioned to benefit from the transition to a low carbon economy. The fund offers a way to target the low carbon transition in a core equity portfolio.,iShares / BlackRock,Equity,Single Country,US,Developed,ESG,Large/Mid Cap,Broad Market,Active,Russell 1000 Index,0.3,1468991396.62,0.11301563,320.0,,,13.5106,1.0182,,,,,,,,,Information Technology,35.83,Financials,11.97,Consumer Discretionary,9.43,Communication; Industrials; Health Care; Consumer Staples; Energy; Materials; Utilities; Real Estate,42.11
LDEM,iShares ESG MSCI EM Leaders ETF,"The iShares ESG MSCI EM Leaders ETF seeks to track an index composed of emerging market companies with high environmental, social, and governance (ESG) characteristics relative to their sector peers. The fund offers exposure to higher ESG rated companies across sectors in a core equity portfolio.",iShares / BlackRock,Equity,Regional,Emerging Markets,Emerging,ESG,Broad/Multi-Cap,Broad Market,Index,MSCI EM Extended ESG Leaders 5% Issuer Capped Index (USD) (Net),0.16,33809022.65,0.12874155,435.0,15.9426,2.05251,13.3768,0.6283,China,31.46,Korea (South),16.47,Taiwan,15.39,India; South Africa; Brazil; Mexico; Saudi Arabia; Malaysia; Poland; United Arab Emirates; Thailand; Greece; Other,36.27,Financials,25.07,Information Technology,19.74,Consumer Discretionary,13.05,Communication; Industrials; Materials; Energy; Consumer Staples; Health Care; Utilities; Real Estate; Other,41.72
LDRC,iShares® iBonds® 1-5 Year Corporate Ladder ETF,"The iShares iBonds 1-5 Year Corporate Ladder ETF seeks to track an index composed of iShares iBonds Corporate ETFs with maturities less than six years. The fund offers a way to streamline bond laddering with investment grade corporate credit.<br /><br />This Fund is covered by U.S. Patent Nos. 8,438,100 and 8,655,770.",iShares / BlackRock,Fixed Income,Single Country,US,Developed,Core,,Other,Index,BlackRock iBonds 1-5 Year Corporate Ladder Index,0.1,83395816.96,0.07974482,5.0,,,,,,,,,,,,,Industrial,62.42,Financial Institutions,28.15,Utility,8.05,Treasury,0.21
LDRH,iShares® iBonds® 1-5 Year High Yield and Income Ladder ETF,"The iShares iBonds 1-5 Year High Yield and Income Ladder ETF seeks to track an index composed of iShares iBonds High Yield and Income ETFs with maturities less than six years. The fund offers a way to streamline bond laddering with high yield bonds.<br /><br />This Fund is covered by U.S. Patent Nos. 8,438,100 and 8,655,770.",iShares / BlackRock,Fixed Income,Single Country,US,Developed,Other,,No information,Index,BlackRock iBonds 1-5 Year High Yield and Income Ladder Index,0.35,8852522.46,0.12123661,5.0,,,,,,,,,,,,,Industrial,77.32,Financial Institutions,17.35,Utility,2.06,Treasury,0.5
LDRI,iShares® iBonds® 1-5 Year TIPS Ladder ETF,"The iShares iBonds 1-5 Year TIPS Ladder ETF seeks to track an index composed of iShares iBonds TIPS ETFs with maturities less than six years. The fund offers a way to streamline bond laddering with U.S. Treasury Inflation-Protected Securities.<br /><br />This Fund is covered by U.S. Patent Nos. 8,438,100 and 8,655,770.",iShares / BlackRock,Fixed Income,Single Country,US,Developed,Core,,Broad Market,Index,BlackRock iBonds 1-5 Year TIPS Ladder Index,0.1,20990953.03,0.11698187,5.0,,,,,,,,,,,,,Treasury,99.74,,,,,,
LDRT,iShares® iBonds® 1-5 Year Treasury Ladder ETF,"The iShares iBonds 1-5 Year Treasury Ladder ETF seeks to track an index composed of iShares iBonds Treasury ETFs with maturities less than six years. The fund offers a way to streamline bond laddering with US Treasury bonds.<br /><br />This Fund is covered by U.S. Patent Nos. 8,438,100 and 8,655,770.",iShares / BlackRock,Fixed Income,Single Country,US,Developed,Core,,Broad Market,Index,BlackRock iBonds 1-5 Year Treasury Ladder Index,0.07,128170806.34,0.07968127,5.0,,,,,,,,,,,,,Treasury,99.4,,,,,,
LEMB,iShares J.P. Morgan EM Local Currency Bond ETF,The iShares J.P. Morgan EM Local Currency Bond ETF seeks to track an index composed of local currency-denominated sovereign bonds issued by emerging market countries. The fund offers a way to suppress U.S. dollar exposure and pursue higher yields through emerging market debt.,iShares / BlackRock,Fixed Income,Global,Emerging Markets,Emerging,Core,,Other,Index,J.P. Morgan GBI-EM Global Diversified 15% Cap 4% Floor Index (Net),0.3,719336566.36,0.0238863,432.0,,,7.3561,0.3314,China,14.91,India,8.67,Mexico,5.97,Malaysia; Indonesia; Poland; Thailand; South Africa; Colombia; Brazil; Peru; Turkey; Hungary; Czech Republic; Dominican Republic; Serbia; Chile; Uruguay; Romania; Paraguay,69.67,Treasuries,99.22,,,,,,
LMUB,iShares Long-Term National Muni Bond ETF,The iShares Long-Term National Muni Bond ETF seeks to track an index composed of investment grade U.S. municipal bonds with maturities of 12 years or more. The fund offers a way to pursue tax-exempt income and add long-duration muni exposure to a portfolio.,iShares / BlackRock,Fixed Income,Single Country,US,Developed,Core,,Broad Market,Index,ICE Long AMT-Free US National Municipal Index,0.09,1638351948.58,0.18009005,743.0,,,,,,,,,,,,,State Tax-Backed,25.17,Local Tax-Backed,20.49,Utility,19.38,School Districts; Transportation; Education; Corporate Muni,31.56
LQD,iShares iBoxx $ Investment Grade Corporate Bond ETF,The iShares iBoxx $ Investment Grade Corporate Bond ETF seeks to track an index that includes U.S. dollar-denominated investment grade corporate bonds. The fund offers a way to pursue income and diversify fixed income exposure through high-quality corporate credit.,iShares / BlackRock,Fixed Income,Single Country,US,Developed,Core,,No information,Index,Markit iBoxx USD Liquid Investment Grade Index,0.14,29783504911.9,0.00921956,3131.0,,,7.6507,0.3546,,,,,,,,,Banking,22.34,Consumer Non-Cyclical,17.3,Technology,13.05,Communications; Energy; Consumer Cyclical; Capital Goods; Electric; Insurance; Basic Industry; Transportation; Brokerage/Asset Managers/Exchanges; Reits; Finance Companies; Natural Gas; Utility Other; Industrial Other; Owned No Guarantee; Financial Other,46.41
LQDB,iShares BBB Rated Corporate Bond ETF,The iShares BBB Rated Corporate Bond ETF seeks to track an index that includes U.S. dollar-denominated corporate bonds rated BBB. The fund offers a way to target the lower tier of investment grade credit for enhanced yield potential.,iShares / BlackRock,Fixed Income,Single Country,US,Developed,Core,,Other,Index,iBoxx USD Liquid Investment Grade BBB 0+ Index,0.15,56078639.3,0.03494671,1500.0,,,5.921,0.2813,,,,,,,,,Consumer Non-Cyclical,17.36,Communications,12.49,Energy,11.17,Technology; Consumer Cyclical; Banking; Electric; Capital Goods; Insurance; Finance Companies; Basic Industry; Reits; Brokerage/Asset Managers/Exchanges; Transportation; Natural Gas; Industrial Other; Financial Other; Utility Other; Owned No Guarantee,55.13
LQDH,iShares Interest Rate Hedged Corporate Bond ETF,The iShares Interest Rate Hedged Corporate Bond ETF seeks to track an index that includes investment grade corporate bonds with a hedge against rising interest rates. The fund offers a way to preserve investment grade corporate bond exposure while helping to reduce rate sensitivity.,iShares / BlackRock,Fixed Income,Regional,US,Developed,Other,,No information,Index,,0.44,518593171.74,0.05373166,1.0,,,2.9234,0.1412,,,,,,,,,Banking,20.91,Consumer Non-Cyclical,16.19,Technology,12.21,Communications; Energy; Consumer Cyclical; Capital Goods; Electric; Insurance; Basic Industry; Transportation; Brokerage/Asset Managers/Exchanges; Treasuries; Reits; Finance Companies; Natural Gas; Utility Other; Industrial Other; Owned No Guarantee; Financial Other,44.51
LQDI,iShares Inflation Hedged Corporate Bond ETF,The iShares Inflation Hedged Corporate Bond ETF seeks to track an index that includes investment grade corporate bonds with an overlay to hedge against inflation. The fund offers a way to preserve investment grade corporate bond exposure while helping to reduce inflation sensitivity.,iShares / BlackRock,Fixed Income,Regional,US,Developed,Other,,No information,Index,,0.33,69990247.51,0.30245747,1.0,,,6.1602,0.326,,,,,,,,,Banking,21.07,Consumer Non-Cyclical,16.32,Technology,12.3,Communications; Energy; Consumer Cyclical; Capital Goods; Electric; Insurance; Basic Industry; Transportation; Brokerage/Asset Managers/Exchanges; Reits; Finance Companies; Treasuries; Natural Gas; Utility Other; Industrial Other; Owned No Guarantee; Financial Other,44.1
LQDW,iShares Investment Grade Corporate Bond BuyWrite Strategy ETF,The iShares Investment Grade Corporate Bond BuyWrite Strategy ETF seeks to track an index that holds the iShares iBoxx $ Investment Grade Corporate Bond ETF (LQD) while writing monthly covered call options to generate income. The fund offers a way to pursue a diversified source of income in addition to dividends.,iShares / BlackRock,Fixed Income,Regional,US,Developed,Dividend,,Financials,Index,Cboe LQD BuyWrite Index,0.34,271914677.27,0.08413967,1.0,,,4.0978,0.1998,,,,,,,,,Banking,22.31,Consumer Non-Cyclical,17.27,Technology,13.03,Communications; Energy; Consumer Cyclical; Capital Goods; Electric; Insurance; Basic Industry; Transportation; Brokerage/Asset Managers/Exchanges; Reits; Finance Companies; Natural Gas; Treasuries; Utility Other; Industrial Other; Owned No Guarantee; Financial Other,46.52
LRGF,iShares U.S. Equity Factor ETF,"The iShares U.S. Equity Factor ETF seeks to track an index of U.S. stocks selected using value, quality, momentum, low volatility, and size factors. The fund offers a way to build a diversified core U.S. equity portfolio using a multifactor strategy.",iShares / BlackRock,Equity,Single Country,US,Developed,Multi-Factor,Broad/Multi-Cap,Broad Market,Index,STOXX U.S. Equity Factor Index,0.08,3438388824.41,0.02715178,292.0,26.41813,5.15394,13.438,1.0021,,,,,,,,,Information Technology,37.18,Financials,12.46,Consumer Discretionary,10.64,Health Care; Industrials; Communication; Consumer Staples; Energy; Utilities; Materials; Real Estate,39.51
MADE,iShares U.S. Manufacturing ETF,"The iShares U.S. Manufacturing ETF seeks to track an index composed of U.S. companies with significant revenue from manufacturing and related industries like industrial manufacturing, automotive, electronics, and semiconductor manufacturing capital equipment. The fund offers a way to express a focused view on domestic manufacturing and potential reshoring trends.",iShares / BlackRock,Equity,Single Country,US,Developed,Core,Broad/Multi-Cap,Technology,Index,S&P U.S. Manufacturing Select Index,0.4,56433684.76,0.13421017,111.0,33.15556,4.83152,,,,,,,,,,,Capital Goods,73.27,Tech Hardware & Equip,16.33,Autos & Components,7.3,Semiconductors & Semiconductor Equipment; Commercial & Professional Services; Consumer Durables,2.77
MAXJ,iShares Large Cap Max Buffer Jun ETF,The iShares Large Cap Max Buffer Jun ETF seeks to participate in the price movements of large cap U.S. equities (as represented by the underlying ETF) with up to 100% downside protection (minus fees) in exchange for capped upside for the 12-month hedge period from July to June. The fund offers a way to gain equity exposure while seeking downside protection.,iShares / BlackRock,Equity,Single Country,US,Developed,Core,Large Cap,Broad Market,Index,S&P 500 Index (USD),0.53,133587930.02,0.17244352,,,,,,,,,,,,,,,,,,,,,
