ticker,etf_name,description,provider,asset_class,geographic_scope,primary_region,developed_or_emerging,style_focus,size_focus,sector_focus,active_vs_index,benchmark_index,expense_ratio,net_assets_usd,bid_ask_spread_30d,number_of_holdings,pe_ratio,pb_ratio,standard_deviation_3y,equity_beta_3y,top_country_1,top_country_1_weight,top_country_2,top_country_2_weight,top_country_3,top_country_3_weight,other_countries,other_countries_weight,top_industry_1,top_industry_1_weight,top_industry_2,top_industry_2_weight,top_industry_3,top_industry_3_weight,other_industries,other_industries_weight
ETHB,iShares Staked Ethereum Trust ETF,"The iShares Staked Ethereum Trust ETF seeks to reflect generally the performance of the price of ether, as well as rewards from staking a position of the Trust's ether. The Trust offers exposure to ether within traditional brokerage accounts without the complexities of direct crypto custody.",iShares / BlackRock,Alternative,Global,No information,No information,Thematic,,Thematic,Index,CME CF Ether Dollar Reference Rate - New York Variant,0.25,523398966.89,0.07401925,2.0,,,,,,,,,,,,,,,,,,,,
EUFN,iShares MSCI Europe Financials ETF,"The iShares MSCI Europe Financials ETF seeks to track an index composed of developed market European equities in the financials sector. The fund can be used to express a regional sector view and gain diversified access to European banks, insurers, and financial services firms.",iShares / BlackRock,Equity,Regional,Europe,Developed,Core,Broad/Multi-Cap,Financials,Index,MSCI Europe Financials Index (Net),0.49,3651512159.74,0.02631233,84.0,11.82055,1.53076,15.7219,0.6517,United Kingdom,23.94,Germany,12.04,Switzerland,11.83,Spain; Italy; France; Netherlands; Sweden; Finland; Austria; Belgium; Ireland; Denmark; Other,51.5,Banks,58.06,Insurance,23.38,Financial Services,17.87,,
EUHY,iShares Euro High Yield Corporate Bond USD Hedged ETF,"The iShares Euro High Yield Corporate Bond USD Hedged ETF seeks to track an index composed of USD-hedged, euro-denominated high yield bonds. The fund offers a way to target euro high yield bonds while mitigating exposure to fluctuations between the euro and the U.S. dollar.",iShares / BlackRock,Fixed Income,Global,Europe,Developed,Core,,Other,Index,Bloomberg Pan-European High Yield (Euro) 100% Hedged to USD Index,0.35,213366569.35,0.03748126,672.0,,,7.6269,0.2418,France,20.25,United States,14.12,Italy,12.33,Germany; United Kingdom; Luxembourg; Spain; Netherlands; Sweden; Japan; Greece; Portugal; Slovenia; Other,52.51,Consumer Cyclical,21.81,Communications,19.89,Consumer Non-Cyclical,12.75,Capital Goods; Basic Industry; Financial Other; Technology; Transportation; Banking; Electric; Industrial Other; Energy; Utility Other; Reits; Finance Companies; Insurance; Natural Gas; Brokerage/Asset Managers/Exchanges,44.76
EUIG,iShares Euro Investment Grade Corporate Bond USD Hedged ETF,The iShares Euro Investment Grade Corporate Bond USD Hedged ETF seeks to track an index composed of Euro-denominated investment-grade bonds that mitigates exposure to fluctuations between the value of the Euro and the U.S. dollar. The fund offers a way to complement U.S. or global bond holdings by diversifying sources of potential income.,iShares / BlackRock,Fixed Income,Global,Europe,Developed,Core,,Broad Market,Index,"BBG Euro Corporate Index, 100% USD Hedged",0.18,21036692.79,0.26018213,197.0,,,,,United States,21.62,France,18.45,Germany,12.87,United Kingdom; Italy; Spain; Netherlands; Sweden; Denmark; Switzerland; Canada; Luxembourg; Japan; Czech Republic; Finland; Austria; Other,44.91,Industrial,48.32,Financial Institutions,41.94,Utility,7.57,,
EUSA,iShares MSCI USA Equal Weighted ETF,The iShares MSCI USA Equal Weighted ETF seeks to track an index composed of equally weighted U.S. stocks. The fund offers a way to diversify and reduce concentration risk from the largest stocks in a market cap weighted portfolio.,iShares / BlackRock,Equity,Single Country,US,Developed,Core,Broad/Multi-Cap,Broad Market,Index,MSCI USA Equal Weighted Index,0.09,1705058204.08,0.08242136,526.0,23.68799,3.31548,14.2328,0.9631,,,,,,,,,Information Technology,17.4,Industrials,16.84,Financials,15.69,Health Care; Consumer Discretionary; Consumer Staples; Materials; Utilities; Real Estate; Energy; Communication,49.79
EUSB,iShares ESG Advanced Universal USD Bond ETF,"The iShares ESG Advanced Universal USD Bond ETF seeks to track an index of investment-grade and high yield USD bonds from issuers with favorable environmental, social, and governance (ESG) ratings while applying extensive screens on controversial activities. The fund offers a way to build broad fixed income exposure while prioritizing ESG considerations in a core bond portfolio.",iShares / BlackRock,Fixed Income,Regional,US,Developed,ESG,,Broad Market,Index,Bloomberg MSCI US Universal Choice ESG Screened Index,0.12,719205058.49,0.02317229,4346.0,,,5.2595,0.2115,,,,,,,,,Treasury,40.0,MBS Pass-Through,20.26,Industrial,18.43,Financial Institutions; Sovereign; Agency; Supranational; CMBS; Local Authority; Utility; ABS,20.44
EVLU,iShares MSCI Emerging Markets Value Factor ETF,The iShares MSCI Emerging Markets Value Factor ETF seeks to track an index of large- and mid-cap emerging market stocks that are potentially undervalued. The fund offers a way to target value-style investing in emerging markets with differentiated exposures.,iShares / BlackRock,Equity,Regional,Emerging Markets,Emerging,Value,Large/Mid Cap,Broad Market,Index,MSCI Emerging Markets Value Factor Select Index (Net),0.35,14962492.03,0.38535645,259.0,12.18376,1.57111,,,Taiwan,28.74,China,23.25,India,12.71,Korea (South); South Africa; Brazil; Saudi Arabia; Mexico; United Arab Emirates; Indonesia; Malaysia; Turkey; Poland; Other,34.72,Information Technology,41.49,Financials,17.96,Consumer Discretionary,9.34,Communication; Materials; Industrials; Energy; Consumer Staples; Health Care; Utilities; Real Estate; Other,30.61
EVUS,iShares ESG Aware MSCI USA Value ETF,"The iShares ESG Aware MSCI USA Value ETF seeks to track an index of U.S. large- and mid-cap value stocks with positive environmental, social, and governance (ESG) characteristics in aggregate. The fund offers a way to target ESG considerations in a value allocation while seeking similar risk and return characteristics as the MSCI USA Value Index.",iShares / BlackRock,Equity,Single Country,US,Developed,ESG,Large/Mid Cap,Broad Market,Index,MSCI USA Value Extended ESG Focus Index,0.18,322769951.94,0.02904866,220.0,22.39017,3.43415,12.7353,0.8286,,,,,,,,,Information Technology,23.23,Financials,18.96,Health Care,12.69,Industrials; Consumer Staples; Energy; Communication; Consumer Discretionary; Real Estate; Materials; Utilities,44.85
EWA,iShares MSCI Australia ETF,The iShares MSCI Australia ETF seeks to track an index composed of Australian equities. The fund offers a way to express a single-country view and gain targeted exposure to companies in Australia.,iShares / BlackRock,Equity,Single Country,Australia,Developed,Core,Broad/Multi-Cap,Broad Market,Index,MSCI Australia Index (Net),0.5,1481644709.88,0.03460806,47.0,20.79249,2.58705,16.5328,0.8529,,,,,,,,,Financials,39.3,Materials,25.86,Consumer Discretionary,6.86,Industrials; Real Estate; Health Care; Energy; Consumer Staples; Communication; Utilities; Information Technology,27.36
EWC,iShares MSCI Canada ETF,The iShares MSCI Canada ETF seeks to track an index composed of Canadian equities. The fund offers a way to express a single-country view and gain targeted exposure to companies in Canada.,iShares / BlackRock,Equity,Single Country,Canada,Developed,Core,Broad/Multi-Cap,Broad Market,Index,MSCI Canada Custom Capped Index,0.5,5920295893.01,0.01713356,85.0,20.49862,2.79741,13.885,0.7677,,,,,,,,,Financials,39.98,Energy,18.01,Materials,14.47,Industrials; Information Technology; Consumer Staples; Consumer Discretionary; Utilities; Communication; Real Estate,27.3
EWD,iShares MSCI Sweden ETF,The iShares MSCI Sweden ETF seeks to track an index composed of Swedish equities. The fund offers a way to express a single-country view and gain targeted exposure to companies in Sweden.,iShares / BlackRock,Equity,Single Country,Sweden,Developed,Core,Broad/Multi-Cap,Broad Market,Index,MSCI Sweden 25/50 Index,0.51,297826397.65,0.09862906,43.0,17.58555,2.59793,19.3627,0.8552,,,,,,,,,Industrials,43.7,Financials,24.09,Communication,13.03,Information Technology; Materials; Consumer Discretionary; Consumer Staples; Health Care; Real Estate,16.68
EWG,iShares MSCI Germany ETF,The iShares MSCI Germany ETF seeks to track an index composed of German equities. The fund offers a way to express a single-country view and gain targeted exposure to companies in Germany.,iShares / BlackRock,Equity,Single Country,Germany,Developed,Core,Broad/Multi-Cap,Broad Market,Index,MSCI Germany Index (Net),0.49,1487764327.2,0.02345491,54.0,17.46832,1.85001,15.9366,0.7621,,,,,,,,,Industrials,30.28,Financials,21.22,Information Technology,15.5,Consumer Discretionary; Communication; Health Care; Materials; Utilities; Consumer Staples; Real Estate,32.58
EWH,iShares MSCI Hong Kong ETF,The iShares MSCI Hong Kong ETF seeks to track an index composed of Hong Kong equities. The fund offers a way to express a single-country view and gain targeted exposure to companies in Hong Kong.,iShares / BlackRock,Equity,Single Country,Hong Kong,Developed,Core,Broad/Multi-Cap,Broad Market,Index,MSCI Hong Kong 25-50 Index (USD) (Net),0.5,1179427823.54,0.04326195,26.0,17.20034,1.12714,18.4196,0.4119,,,,,,,,,Insurance,20.92,Financial Services,16.55,Capital Goods,14.98,Real Estate Management & Development; Utilities; Banks; Consumer Services; Transportation; Real Estate; Food Bevg Tobacco; Telecommunications,45.86
EWI,iShares MSCI Italy ETF,The iShares MSCI Italy ETF seeks to track an index composed of Italian equities. The fund offers a way to express a single-country view and gain targeted exposure to companies in Italy.,iShares / BlackRock,Equity,Single Country,Italy,Developed,Core,Broad/Multi-Cap,Broad Market,Index,MSCI Italy 25/50 Index (Net),0.5,672207000.17,0.01698514,25.0,14.47559,1.97806,15.8323,0.6934,,,,,,,,,Financials,50.98,Utilities,17.98,Consumer Discretionary,9.25,Industrials; Energy; Communication; Health Care; Materials; Consumer Staples,21.66
EWJ,iShares MSCI Japan ETF,The iShares MSCI Japan ETF seeks to track an index composed of Japanese equities. The fund offers a way to express a single-country view and gain targeted exposure to companies in Japan.,iShares / BlackRock,Equity,Single Country,Japan,Developed,Core,Broad/Multi-Cap,Broad Market,Index,MSCI Japan Index (Net),0.49,21691025646.08,0.01085717,168.0,18.26763,1.95867,13.4606,0.6832,,,,,,,,,Industrials,23.19,Information Technology,19.96,Financials,18.06,Consumer Discretionary; Communication; Health Care; Materials; Consumer Staples; Real Estate; Utilities; Energy,37.96
EWJV,iShares MSCI Japan Value ETF,The iShares MSCI Japan Value ETF seeks to track an index composed of Japanese equities with value characteristics based on fundamentals. The fund offers a way to target undervalued companies in Japan or express a style-based view on the Japanese market.,iShares / BlackRock,Equity,Single Country,Japan,Developed,Value,Broad/Multi-Cap,Broad Market,Index,MSCI Japan Value Index (USD) (Net),0.15,712886303.21,0.26548673,109.0,14.11648,1.36015,12.9491,0.4307,,,,,,,,,Financials,32.03,Industrials,19.05,Consumer Discretionary,14.74,Communication; Information Technology; Materials; Consumer Staples; Real Estate; Health Care; Energy; Utilities,33.13
EWK,iShares MSCI Belgium ETF,The iShares MSCI Belgium ETF seeks to track an index composed of Belgian equities. The fund offers a way to express a single-country view and gain targeted exposure to companies in Belgium.,iShares / BlackRock,Equity,Single Country,Belgium,Developed,Core,Broad/Multi-Cap,Broad Market,Index,MSCI Belgium IMI 25/50 Index (Net),0.49,154545211.54,0.33426184,39.0,18.85842,1.76113,14.7151,0.5499,,,,,,,,,Health Care,28.43,Consumer Staples,24.66,Financials,15.38,Real Estate; Materials; Industrials; Utilities; Consumer Discretionary; Information Technology; Communication; Energy,30.83
EWL,iShares MSCI Switzerland ETF,The iShares MSCI Switzerland ETF seeks to track an index composed of Swiss equities. The fund offers a way to express a single-country view and gain targeted exposure to companies in Switzerland.,iShares / BlackRock,Equity,Single Country,Switzerland,Developed,Core,Broad/Multi-Cap,Broad Market,Index,MSCI Switzerland 25/50 Index (Net),0.5,1934485679.88,0.01619564,40.0,23.06825,3.99917,15.361,0.6267,,,,,,,,,Health Care,36.55,Financials,17.31,Consumer Staples,13.79,Industrials; Materials; Consumer Discretionary; Communication; Information Technology; Real Estate; Utilities,30.76
EWM,iShares MSCI Malaysia ETF,The iShares MSCI Malaysia ETF seeks to track an index composed of Malaysian equities. The fund offers a way to express a single-country view and gain targeted exposure to companies in Malaysia.,iShares / BlackRock,Equity,Single Country,Malaysia,Emerging,Core,Broad/Multi-Cap,Broad Market,Index,MSCI Malaysia Index,0.5,338049880.41,0.03491011,21.0,14.61976,1.57389,13.4077,0.2432,,,,,,,,,Financials,50.74,Utilities,13.8,Industrials,10.1,Materials; Consumer Staples; Communication; Health Care,25.1
EWN,iShares MSCI Netherlands ETF,The iShares MSCI Netherlands ETF seeks to track an index composed of Dutch equities. The fund offers a way to express a single-country view and gain targeted exposure to companies in Netherlands.,iShares / BlackRock,Equity,Single Country,Netherlands,Developed,Core,Broad/Multi-Cap,Broad Market,Index,MSCI Netherlands IMI 25/50 Index,0.5,550669530.52,0.14771049,55.0,19.75015,3.03211,18.6824,1.0114,,,,,,,,,Information Technology,39.39,Financials,20.15,Industrials,11.86,Consumer Staples; Consumer Discretionary; Communication; Materials; Health Care; Energy; Real Estate,28.37
EWO,iShares MSCI Austria ETF,The iShares MSCI Austria ETF seeks to track an index composed of Austrian equities. The fund offers a way to express a single-country view and gain targeted exposure to companies in Austria.,iShares / BlackRock,Equity,Single Country,Austria,Developed,Core,Broad/Multi-Cap,Broad Market,Index,MSCI Austria IMI 25/50 Index (Net),0.49,138543852.29,0.29314767,21.0,14.0782,1.48773,15.322,0.5392,,,,,,,,,Financials,47.66,Industrials,14.99,Materials,11.65,Energy; Utilities; Information Technology; Real Estate,23.84
EWP,iShares MSCI Spain ETF,The iShares MSCI Spain ETF seeks to track an index composed of Spanish equities. The fund offers a way to express a single-country view and gain targeted exposure to companies in Spain.,iShares / BlackRock,Equity,Single Country,Spain,Developed,Core,Broad/Multi-Cap,Broad Market,Index,MSCI Spain 25/50 Index (Net),0.5,1830951954.77,0.13884068,22.0,14.50236,2.18745,16.6094,0.5366,,,,,,,,,Financials,42.14,Utilities,24.05,Industrials,13.92,Consumer Discretionary; Communication; Energy; Information Technology,19.57
EWQ,iShares MSCI France ETF,The iShares MSCI France ETF seeks to track an index composed of French equities. The fund offers a way to express a single-country view and gain targeted exposure to companies in France.,iShares / BlackRock,Equity,Single Country,France,Developed,Core,Broad/Multi-Cap,Broad Market,Index,,0.5,391155536.37,0.02191781,55.0,18.0978,2.11122,14.7861,0.6413,,,,,,,,,Industrials,30.16,Financials,12.75,Consumer Discretionary,12.21,Health Care; Consumer Staples; Energy; Materials; Utilities; Information Technology; Communication; Real Estate,44.17
EWS,iShares MSCI Singapore ETF,The iShares MSCI Singapore ETF seeks to track an index composed of Singaporean equities. The fund offers a way to express a single-country view and gain targeted exposure to companies in Singapore.,iShares / BlackRock,Equity,Single Country,Singapore,Developed,Core,Broad/Multi-Cap,Broad Market,Index,MSCI Singapore 25/50 Index,0.5,888282995.52,0.03414717,18.0,16.57288,1.86288,12.2479,0.4115,,,,,,,,,Financials,52.3,Industrials,21.94,Real Estate,9.11,Consumer Discretionary; Utilities; Consumer Staples; Communication,16.36
EWT,iShares MSCI Taiwan ETF,The iShares MSCI Taiwan ETF seeks to track an index composed of Taiwanese equities. The fund offers a way to express a single-country view and gain targeted exposure to companies in Taiwan.,iShares / BlackRock,Equity,Single Country,Taiwan,Developed,Core,Broad/Multi-Cap,Broad Market,Index,MSCI Taiwan 25/50 Index,0.59,10675414898.0,0.01026325,79.0,30.91178,4.06818,23.1605,1.2498,,,,,,,,,Information Technology,75.33,Financials,13.6,Industrials,3.2,Materials; Communication; Consumer Staples; Health Care; Consumer Discretionary,7.64
EWU,iShares MSCI United Kingdom ETF,The iShares MSCI United Kingdom ETF seeks to track the of U.K. equities. The fund offers a way to express a single-country view and gain targeted exposure to companies in the United Kingdom.,iShares / BlackRock,Equity,Single Country,United Kingdom,Developed,Core,Broad/Multi-Cap,Broad Market,Index,MSCI Developed - United Kingdom in USD,0.5,3660987006.27,0.02137894,67.0,17.17576,2.2962,11.6603,0.4479,,,,,,,,,Financials,25.59,Consumer Staples,14.19,Health Care,13.83,Industrials; Energy; Materials; Utilities; Consumer Discretionary; Communication; Information Technology; Real Estate,45.65
EWUS,iShares MSCI United Kingdom Small-Cap ETF,The iShares MSCI United Kingdom Small-Cap ETF seeks to track an index composed of small cap U.K. equities. The fund offers a way to target smaller companies in the U.K. or complement broader U.K. exposure.,iShares / BlackRock,Equity,Single Country,United Kingdom,Developed,Core,Small Cap,Broad Market,Index,MSCI United Kingdom Small Cap Index (Net),0.59,43043205.36,0.1396323,199.0,14.71317,1.64797,18.5217,0.9026,,,,,,,,,Industrials,22.79,Financials,22.57,Consumer Discretionary,16.52,Real Estate; Communication; Materials; Consumer Staples; Energy; Information Technology; Health Care; Utilities,37.43
EWW,iShares MSCI Mexico ETF,The iShares MSCI Mexico ETF seeks to track an index composed of Mexican equities. The fund offers a way to express a single-country view and gain targeted exposure to companies in Mexico.,iShares / BlackRock,Equity,Single Country,Mexico,Emerging,Core,Broad/Multi-Cap,Broad Market,Index,MSCI Mexico IMI 25/50 Index (Net),0.5,2018469098.93,0.04008284,39.0,13.57354,2.09731,20.3807,0.6064,,,,,,,,,Materials,25.66,Consumer Staples,24.76,Financials,17.47,Industrials; Communication; Real Estate; Consumer Discretionary; Health Care,31.54
EWY,iShares MSCI South Korea ETF,The iShares MSCI South Korea ETF seeks to track an index of South Korean equities. The fund offers a way to express a single-country view and seek targeted exposure to companies in South Korea.,iShares / BlackRock,Equity,Single Country,South Korea,Developed,Core,Broad/Multi-Cap,Broad Market,Index,MSCI Korea 25/50 Index (Net),0.59,23374663701.31,0.04045103,78.0,24.77171,2.6162,41.1039,1.7631,,,,,,,,,Information Technology,51.91,Industrials,19.94,Financials,9.57,Consumer Discretionary; Health Care; Communication; Consumer Staples; Materials; Energy; Utilities,17.72
EWZ,iShares MSCI Brazil ETF,The iShares MSCI Brazil ETF seeks to track an index composed of Brazilian equities. The fund offers a way to express a single-country view and gain targeted exposure to companies in Brazil.,iShares / BlackRock,Equity,Single Country,Brazil,Emerging,Core,Broad/Multi-Cap,Broad Market,Index,MSCI Brazil 25/50 Index (Net),0.59,9351640819.02,0.02789789,46.0,10.38109,1.71217,24.762,0.4648,,,,,,,,,Financials,35.29,Energy,15.53,Materials,14.66,Utilities; Industrials; Consumer Staples; Consumer Discretionary; Communication; Health Care,33.05
EWZS,iShares MSCI Brazil Small-Cap ETF,The iShares MSCI Brazil Small-Cap ETF seeks to track an index composed of small-cap Brazilian equities. The fund offers a way to target smaller companies in Brazil or complement broader Brazil exposure.,iShares / BlackRock,Equity,Single Country,Brazil,Emerging,Core,Small Cap,Broad Market,Index,MSCI Brazil Small Cap Index (Net),0.59,244655961.85,0.21451555,70.0,7.74428,0.95938,27.6369,0.74,,,,,,,,,Consumer Discretionary,22.95,Materials,12.89,Utilities,12.2,Consumer Staples; Real Estate; Financials; Industrials; Health Care; Information Technology; Energy,50.84
EXI,iShares Global Industrials ETF,The iShares Global Industrials ETF seeks to track an index composed of global equities in the industrials sector. The fund can be used to express a global sector view and gain exposure to companies driving construction and manufacturing.,iShares / BlackRock,Equity,Global,Global,Developed,Core,Broad/Multi-Cap,Industrials,Index,,0.39,1389415544.61,0.20765198,213.0,26.94042,4.5429,15.8217,0.9391,United States,55.91,Japan,12.96,France,6.46,Germany; United Kingdom; Sweden; Switzerland; Canada; Korea (South); Other,23.99,Capital Goods,76.88,Transportation,13.8,Commercial & Professional Services,8.63,,
EZA,iShares MSCI South Africa ETF,The iShares MSCI South Africa ETF seeks to track an index composed of South African equities. The fund offers a way to express a single-country view and gain targeted exposure to companies in South Africa.,iShares / BlackRock,Equity,Single Country,South Africa,Emerging,Core,Broad/Multi-Cap,Broad Market,Index,MSCI South Africa 25/50 Index,0.59,629120479.62,0.29537734,27.0,12.93416,2.19673,22.6833,0.5666,,,,,,,,,Materials,35.9,Financials,35.0,Consumer Discretionary,12.27,Communication; Consumer Staples; Real Estate; Industrials,16.52
EZU,iShares MSCI Eurozone ETF,The iShares MSCI Eurozone ETF seeks to track an index composed of large- and mid-cap equities from developed countries using the Euro. The fund offers a way to diversify internationally and express a regional view on the Eurozone.,iShares / BlackRock,Equity,Regional,Europe,Developed,Core,Large/Mid Cap,Broad Market,Index,MSCI EMU Index (Net),0.5,9520789713.52,0.01464236,222.0,18.20698,2.26875,14.8255,0.7262,France,28.04,Germany,24.65,Netherlands,17.5,Spain; Italy; Finland; Belgium; Ireland; Other,29.6,Financials,24.44,Industrials,19.66,Information Technology,17.14,Consumer Discretionary; Utilities; Health Care; Consumer Staples; Materials; Energy; Communication; Real Estate,38.56
FALN,iShares Fallen Angels USD Bond ETF,The iShares Fallen Angels USD Bond ETF seeks to track an index of U.S. dollar-denominated bonds that were previously investment grade but downgraded to high yield. The fund offers a way to capture potential value from credit rating changes.,iShares / BlackRock,Fixed Income,Single Country,US,Developed,Value,,Other,Index,Bloomberg US High Yield Fallen Angel 3% Capped Index,0.25,1610492066.61,0.03705762,158.0,,,5.5121,0.3264,,,,,,,,,Consumer Cyclical,22.19,Communications,14.3,Basic Industry,13.01,Reits; Energy; Consumer Non-Cyclical; Insurance; Capital Goods; Finance Companies; Electric; Technology; Industrial Other; Transportation,49.94
FLOT,iShares Floating Rate Bond ETF,"The iShares Floating Rate Bond ETF seeks to track an index of U.S. dollar-denominated, investment-grade floating rate bonds. The fund offers a way to help reduce interest rate risk while seeking income from corporate debt.",iShares / BlackRock,Fixed Income,Single Country,US,Developed,Other,,Other,Index,Bloomberg US Floating Rate Note < 5 Years Index (USD),0.15,9785324829.9,0.01962131,544.0,,,0.3714,0.0089,,,,,,,,,Banking,48.31,Supranational,20.9,Consumer Cyclical,8.95,Owned No Guarantee; Insurance; Consumer Non-Cyclical; Capital Goods; Technology; Electric; Energy; Local Authority; Communications; Brokerage/Asset Managers/Exchanges; Basic Industry; Reits; Government Sponsored; Government Guaranteed; Industrial Other,21.57
FXI,iShares China Large-Cap ETF,The iShares China Large-Cap ETF seeks to track an index composed of large cap Chinese equities listed on the Hong Kong Stock Exchange. The fund offers a way to express a single country view and gain exposure to large cap companies in China.,iShares / BlackRock,Equity,Single Country,Hong Kong,Developed,Core,Large Cap,Broad Market,Index,FTSE China 50 Index (Net),0.73,5261406843.46,0.02818887,50.0,10.86985,1.33158,20.706,0.3139,,,,,,,,,Financials,35.92,Consumer Discretionary,24.61,Communication,16.41,Energy; Information Technology; Materials; Industrials; Health Care; Real Estate; Consumer Staples; Utilities,22.12
GARP,iShares MSCI USA Quality GARP ETF,The iShares MSCI USA Quality GARP ETF seeks to track an index of U.S. growth stocks with favorable value and quality characteristics. The fund offers a way to invest in growth companies at reasonable prices for potential long-term portfolio appreciation.,iShares / BlackRock,Equity,Single Country,US,Developed,Quality,Broad/Multi-Cap,Broad Market,Index,MSCI USA Quality GARP Select Index,0.15,2328727133.05,0.06494772,131.0,38.06209,11.29755,18.0672,1.2713,,,,,,,,,Information Technology,55.05,Communication,10.83,Consumer Discretionary,9.0,Industrials; Financials; Health Care; Energy; Materials; Utilities,24.98
GBF,iShares Government/Credit Bond ETF,The iShares Government/Credit Bond ETF seeks to track an index of U.S. dollar-denominated government and investment-grade corporate bonds. The fund offers a way to diversify fixed income exposure across sectors and maturities.,iShares / BlackRock,Fixed Income,Single Country,US,Developed,Core,,Broad Market,Index,Bloomberg U.S. Government/Credit Bond Index,0.2,124179596.94,0.04844727,3284.0,,,5.3133,0.2071,,,,,,,,,Treasury,60.45,Industrial,18.67,Financial Institutions,10.26,Utility; Agency; Sovereign; Supranational; Local Authority,10.17
